{
  "as_of": "2026-07-31T02:23:13.575686Z",
  "contract_version": "0.2.0",
  "coverage": {
    "daily_complete_bars": 4999,
    "h4_complete_bars": 299,
    "last_daily_complete_at": "2026-07-29T21:00:00.000000000Z",
    "last_h4_complete_at": "2026-07-30T21:00:00.000000000Z"
  },
  "data_cutoff": "2026-07-31T02:23:13.524862Z",
  "instrument": "XAUUSD",
  "licence": {
    "accepted_by_account_holder": true,
    "locator": "https://www.oanda.com/legal/",
    "name": "OANDA API Agreement",
    "region_or_entity": "Global / Singapore / US",
    "usage_scope": "internal_evaluation",
    "verified_at": "2026-07-31T01:22:00Z",
    "version_or_effective_date": "2026"
  },
  "manifest_id": "evidence-run-20260731-xauusd",
  "provenance": {
    "created_at": "2026-07-31T02:23:13.575686Z",
    "created_by": "prepare-oanda-bundle",
    "runtime_version": "dao-certified-runtime:0.2.0",
    "source_policy_version": "data-source-qualification:0.1.0"
  },
  "provider": {
    "account_instrument_verified": true,
    "environment": "practice",
    "instrument_id": "XAU_USD",
    "provider_id": "oanda-v20",
    "qualification_version": "data-source-qualification:0.1.0"
  },
  "quality": {
    "future_records": false,
    "missing_intervals": [],
    "notes": [
      "Gap interpretation uses the frozen OANDA XAU/USD NY17 session sequence.",
      "Official snapshot freshness was attested in the local config."
    ],
    "stale": false
  },
  "snapshots": [
    {
      "available_at": "2026-07-31T02:23:10.634406Z",
      "bytes": 1637,
      "captured_at": "2026-07-31T02:23:10.634406Z",
      "complete_only": true,
      "first_observed_at": "2026-07-31T02:23:10.634406Z",
      "freshness_max_seconds": 600,
      "last_observed_at": "2026-07-31T02:23:10.634406Z",
      "private_location_ref": "private://oanda-instrument-xauusd.json",
      "record_count": 1,
      "request_id": "79546375313306568",
      "request_locator_redacted": "/v3/accounts/{accountID}/instruments?instruments=XAU_USD",
      "role": "instrument_spec",
      "sha256": "a91135853e05669b1a46020415631486fad4166b7aa5ff20a8f7a4ccd718bbeb",
      "snapshot_id": "snapshot-instrument-spec",
      "source_locator": "https://developer.oanda.com/rest-live-v20/account-ep/",
      "source_response_location_ref": "private://oanda-instrument-source.json",
      "source_response_sha256": "3b0055d8a0eb6fab9dae518c979de111218774f19ea2589d2306a4dfd938d33a",
      "source_timezone": "UTC",
      "timestamp_semantics": "not_applicable",
      "transform_id": "oanda-xauusd-instrument-filter:0.1.0"
    },
    {
      "available_at": "2026-07-31T02:23:11.484271Z",
      "bytes": 1149397,
      "captured_at": "2026-07-31T02:23:11.484271Z",
      "complete_only": true,
      "first_observed_at": "2008-06-16T21:00:00.000000000Z",
      "freshness_max_seconds": 600,
      "last_observed_at": "2026-07-29T21:00:00.000000000Z",
      "private_location_ref": "private://oanda-d-complete.json",
      "record_count": 4999,
      "request_id": "61531976801567855",
      "request_locator_redacted": "/v3/accounts/{accountID}/instruments/XAU_USD/candles?price=M&granularity=D&count=5000&dailyAlignment=17&alignmentTimezone=America%2FNew_York&smooth=false",
      "role": "price_daily",
      "sha256": "093fc16ee985b5a042080e34174e9f5d02d7e9e133f321d1d1729151da533b83",
      "snapshot_id": "snapshot-price-daily",
      "source_locator": "https://developer.oanda.com/rest-live-v20/pricing-ep/",
      "source_response_location_ref": "private://oanda-d-source.json",
      "source_response_sha256": "5342a1cc36720b68e13c8e004d77d01be21632bb0fd62cf961ea617fdea5e670",
      "source_timezone": "UTC; daily alignment America/New_York 17:00",
      "timestamp_semantics": "open_time",
      "transform_id": "oanda-complete-midpoint-candles:0.1.0"
    },
    {
      "available_at": "2026-07-31T02:23:12.033413Z",
      "bytes": 69082,
      "captured_at": "2026-07-31T02:23:12.033413Z",
      "complete_only": true,
      "first_observed_at": "2026-05-21T21:00:00.000000000Z",
      "freshness_max_seconds": 600,
      "last_observed_at": "2026-07-30T21:00:00.000000000Z",
      "private_location_ref": "private://oanda-h4-complete.json",
      "record_count": 299,
      "request_id": "61531976805763245",
      "request_locator_redacted": "/v3/accounts/{accountID}/instruments/XAU_USD/candles?price=M&granularity=H4&count=300&dailyAlignment=17&alignmentTimezone=America%2FNew_York&smooth=false",
      "role": "price_h4",
      "sha256": "f8545bf8b94de4e11e81ff87c504a3d0e17a9121326c7dd8b87fef7238b2d39f",
      "snapshot_id": "snapshot-price-h4",
      "source_locator": "https://developer.oanda.com/rest-live-v20/pricing-ep/",
      "source_response_location_ref": "private://oanda-h4-source.json",
      "source_response_sha256": "51572d80e8d08ab4e9f37620814f72f88a60497e0ad11d1656b658f03a495645",
      "source_timezone": "UTC; daily alignment America/New_York 17:00",
      "timestamp_semantics": "open_time",
      "transform_id": "oanda-complete-midpoint-candles:0.1.0"
    },
    {
      "available_at": "2026-07-31T02:23:12.621578Z",
      "bytes": 115221,
      "captured_at": "2026-07-31T02:23:12.621578Z",
      "complete_only": true,
      "first_observed_at": "2026-07-31T00:00:00Z",
      "freshness_max_seconds": 345600,
      "last_observed_at": "2026-07-31T00:00:00Z",
      "private_location_ref": "private://official-macro_rates.snapshot",
      "record_count": 1,
      "request_id": null,
      "request_locator_redacted": "https://home.treasury.gov/policy-issues/financing-the-government/interest-rate-statistics",
      "role": "macro_rates",
      "sha256": "cbd081c6530b4c4d8d2773981a4a6009f1f96947a890874b804237159c63c575",
      "snapshot_id": "snapshot-macro-rates",
      "source_locator": "https://home.treasury.gov/policy-issues/financing-the-government/interest-rate-statistics",
      "source_response_location_ref": "private://official-macro_rates.snapshot",
      "source_response_sha256": "cbd081c6530b4c4d8d2773981a4a6009f1f96947a890874b804237159c63c575",
      "source_timezone": "America/New_York",
      "timestamp_semantics": "publication_time",
      "transform_id": "identity-copy:0.1.0"
    },
    {
      "available_at": "2026-07-31T02:23:13.200924Z",
      "bytes": 83502,
      "captured_at": "2026-07-31T02:23:13.200924Z",
      "complete_only": true,
      "first_observed_at": "2026-07-31T00:00:00Z",
      "freshness_max_seconds": 345600,
      "last_observed_at": "2026-07-31T00:00:00Z",
      "private_location_ref": "private://official-macro_usd.snapshot",
      "record_count": 1,
      "request_id": null,
      "request_locator_redacted": "https://www.federalreserve.gov/releases/h10/hist/",
      "role": "macro_usd",
      "sha256": "d4e7d8ab6ed5855d0dd146d1d1bf68cc8e18df3c87f8e140676aeec31f5c1287",
      "snapshot_id": "snapshot-macro-usd",
      "source_locator": "https://www.federalreserve.gov/releases/h10/hist/",
      "source_response_location_ref": "private://official-macro_usd.snapshot",
      "source_response_sha256": "d4e7d8ab6ed5855d0dd146d1d1bf68cc8e18df3c87f8e140676aeec31f5c1287",
      "source_timezone": "America/New_York",
      "timestamp_semantics": "publication_time",
      "transform_id": "identity-copy:0.1.0"
    },
    {
      "available_at": "2026-07-31T02:23:13.524671Z",
      "bytes": 166536,
      "captured_at": "2026-07-31T02:23:13.524671Z",
      "complete_only": true,
      "first_observed_at": "2026-07-31T00:00:00Z",
      "freshness_max_seconds": 86400,
      "last_observed_at": "2026-07-31T00:00:00Z",
      "private_location_ref": "private://official-event_clock.htm",
      "record_count": 1,
      "request_id": null,
      "request_locator_redacted": "https://www.federalreserve.gov/monetarypolicy/fomccalendars.htm",
      "role": "event_clock",
      "sha256": "bd0b9f6208f9ede08a96f98bb94bd415cb25a39db18412c03ff6fd17bea5b922",
      "snapshot_id": "snapshot-event-clock",
      "source_locator": "https://www.federalreserve.gov/monetarypolicy/fomccalendars.htm",
      "source_response_location_ref": "private://official-event_clock.htm",
      "source_response_sha256": "bd0b9f6208f9ede08a96f98bb94bd415cb25a39db18412c03ff6fd17bea5b922",
      "source_timezone": "UTC",
      "timestamp_semantics": "event_time",
      "transform_id": "identity-copy:0.1.0"
    }
  ]
}
